{
  "schemaVersion": 1,
  "operationId": "00000000-0000-4000-8000-000000000044",
  "sceneId": "scene:sha256:1111111111111111111111111111111111111111111111111111111111111111",
  "authorityClass": "PRESENTATION",
  "sourceRevision": {
    "sceneInputRevision": "input:sha256:2222222222222222222222222222222222222222222222222222222222222222",
    "sourceRootIdentity": "source-root:sha256:3333333333333333333333333333333333333333333333333333333333333333",
    "engineeringSourceDigest": "4444444444444444444444444444444444444444444444444444444444444444",
    "sheetDigest": "5555555555555555555555555555555555555555555555555555555555555555",
    "styleDigest": "absent",
    "lockDigest": "6666666666666666666666666666666666666666666666666666666666666666",
    "packageItemDigests": [
      {
        "packageId": "com.engineeringood.m44.rollingshutter@0.1.0",
        "itemId": "snapshot",
        "sha256": "7777777777777777777777777777777777777777777777777777777777777777"
      }
    ],
    "compilerVersion": "athena-compiler-1",
    "sceneSchemaVersion": "scene-schema-1",
    "profileVersion": "svg-safe-1"
  },
  "target": { "identities": ["route"] },
  "sourceTrace": {
    "traceId": "trace:sha256:8888888888888888888888888888888888888888888888888888888888888888",
    "subjectId": "rolling-shutter-power-route"
  },
  "requestedWritableFiles": ["src/rolling-shutter.sheet.style.athena"],
  "body": {
    "kind": "SET_STYLE",
    "sheetId": "rolling-shutter",
    "target": { "kind": "ROLE", "id": "route" },
    "fields": { "strokeWidth": 2, "routeMarker": "END_ARROW" }
  }
}
